,id,brand_id,brand_name,name,model,url_key,price,quantity_sold,create_at,battery_capacity,battery_type,bluetooth,camera_back,camera_front,camera_feature,card_slot,card_type,card_up_to,chipset,cpu,gpu,ram,storage_capacity,storage_capacity2,dimensions,height,width,deep,weight,display_size,display_type,display_resolution,network_4g,accessories,headphone_jack,sim_slot,sim_type,material,charge_port,recording,wifi,made_in
179,188701588,18802.0,Samsung,Điện thoại Samsung Galaxy A13 4GB/128GB Cam - Hàng Chính Hãng,SM-A135F/DS,dien-thoai-samsung-galaxy-a13-4gb-128gb-cam-hang-chinh-hang-p188701588,4690000,,90.0, 5000 mAh,Li-Po,có,,,có,,,có,Exynos 850 8 nhân, 2.0 GHz, Mali-G52,4GB,128GB,128gb,,,,,195g,6.6 inch, PLS TFT LCD,1080 x 2408 (FHD+),có,,3.5 mm,2,Nano,, Type-C,có,có,Việt Nam
180,5868813,229213.0,Bphone,Điện Thoại Bphone 3 - Hàng Chính Hãng,,dien-thoai-bphone-3-hang-chinh-hang-p5868813,6990000,5,1447.0,3000 mAh,Pin chuẩn Li-Po,"A2DP, LE, v5.0",,,"Lấy nét theo pha, A.I Camera, Chụp ảnh xóa phông, Tự động lấy nét, Chạm lấy nét",MicroSD,,256GB,,1.8 GHz,Adreno 509,3 GB,32 GB,,<p>152 x 75.3 x 7.5 mm</p>,,,,160 g,6 inch,IPS LCD,Full HD+ (2160 x 1080 pixels),,"<p> </p>
<p> </p>",,2,Nano sim,,USB Type-C,"Quay phim FullHD 1080p@120fps, Quay phim 4K 2160p@30fps","Wi-Fi 802.11 a/b/g/n/ac, Dual-band, Wi-Fi Direct, Wi-Fi hotspot",
181,176036536,25643.0,OPPO,Điện Thoại OPPO RENO7 4G (8GB/128GB) - Hàng Chính Hãng,Reno7 4G,dien-thoai-oppo-reno7-4g-8gb-128gb-hang-chinh-hang-p176036536,8990000,,159.0,4500mAh,Li-Po,5.1,,,,MicroSD,,1TB,Qualcomm Snapdragon 680,tối đa 2.4GHz,Adreno 610,8GB,256GB,128GB,,,,,175g,6.4 inch,AMOLED,Full HD+ (1080 x 2240 pixels),,,3.5mm,2,Nano SIM,,Type-C,,"Wifi 2.4G/5G, 802.11 a/b/g/n/ac",
182,193206340,18802.0,Samsung,Điện thoại Samsung Galaxy Z Fold 4 5G 256GB Xám - Hàng chính hãng,F936,dien-thoai-samsung-galaxy-z-fold-4-5g-256gb-xam-hang-chinh-hang-p193206340,40990000,,56.0,,,,,,,,,,,,,,,256,,,,,,,,,,,,,,,,,,Việt Nam
183,141133864,25643.0,OPPO,Điện Thoại Oppo A15s 4GB/64GB - Hàng Chính Hãng,A15s 4GB/64GB,dien-thoai-oppo-a15s-4gb-64gb-hang-chinh-hang-p141133864,4290000,5,312.0,,Li-Ion,v5.0,,,,MicroSD,,Tối đa 256 GB,MediaTek Helio P35 8 nhân,4 nhân 2.3 GHz & 4 nhân 1.8 GHz,,4GB, 64GB,,"<div class=""ctLeft"">
<p>Kích thước, khối lượng:</p>
</div>
<div class=""ctRight""><span class="""">Dài 164 mm - Ngang 75.4 mm - Dày 7.9 mm - Nặng 175 g</span></div>",,,,175 g,6.52 inch,LCD,,,"<p>Điện Thoại Oppo A15s 4GB/64GB - Hàng Chính Hãng</p>
<p>Bộ sản phẩm bao gồm: Thân máy, sạc, cáp USB, dụng cụ lấy sim, sách hướng dẫn, ốp lưng điện thoại.</p>",3.5 mm,2,Nano SIM, Khung & Mặt lưng nhựa,Micro USB,,"Wi-Fi 802.11 a/b/g/n,  Wi-Fi Direct,  Wi-Fi hotspot",
184,191548156,18802.0,Samsung,Điện Thoại Samsung Galaxy S22 Ultra 5G 128GB/256GB/512GB - Hàng Chính Hãng,,dien-thoai-samsung-galaxy-s22-ultra-5g-128gb-256gb-512gb-hang-chinh-hang-p191548156,33990000,,60.0,,,,,,,,,,,,,8GB,,,,,,,,,,,,,,,,,,,,Việt Nam
185,190691224,25422.0,Xiaomi,Điện thoại Xiaomi Redmi Note 11 Pro 5G - Hàng chính hãng,Redmi Note 11 Pro 5G,dien-thoai-xiaomi-redmi-note-11-pro-5g-hang-chinh-hang-p190691224,7990000,,73.0,,Li-ion,Có,,,,Có,,Tối đa 1TB,Snapdragon 695,2.2ghz; Mali G75,,,,128 GB,,,,,202g,6.67 inch,OLED,Full HD+ (1080 x 2400 Pixels),,"<p>Hộp, Sách hướng dẫn, Cây lấy sim, Ốp lưng, Cáp Type C - Type A, Củ sạc nhanh rời đầu Type A</p>",Jack 3.5mm,2,Nano,Nhựa Kính,Type-c,,Có,
186,169744019,25422.0,Xiaomi,Điện thoại Xiaomi Redmi Note 11 (4GB/64GB) - Xám - Hàng chính hãng,Redmi Note 11 (4GB/64GB) ,dien-thoai-xiaomi-redmi-note-11-4gb-64gb-xam-hang-chinh-hang-p169744019,4690000,,195.0,,,v5.0,,,,,,1 TB,,,,,,54 GB,<p>Dài 159.8 mm - Ngang 73.87 mm - Dày 8.09 mm - Nặng 179 g</p>,,,,Nặng 179 g,6.43 inch,AMOLED,Full HD+ (1080 x 2400 Pixels),,<p>AMOLED</p>, 3.5 mm,2,Nano,,,,"Wi-Fi 802.11 a/b/g/n/ac, Wi-Fi Direct",
187,193207892,18802.0,Samsung,Điện thoại Samsung Galaxy Z Flip 4 5G 128GB Tím - Hàng chính hãng,F721,dien-thoai-samsung-galaxy-z-flip-4-5g-128gb-tim-hang-chinh-hang-p193207892,23990000,,56.0,,,,,,,,,,,,,,,,,,,,,,,,,,,,,,,,,Việt Nam
188,137572223,25643.0,OPPO,Điện Thoại Oppo A55 4GB/64GB - Hàng Chính Hãng,A55 4GB/64GB,dien-thoai-oppo-a55-4gb-64gb-hang-chinh-hang-p137572223,4990000,8,325.0,, Li-Po,"A2DP,  LE,  v5.0",,,,MicroSD,,Tối đa 256 GB, MediaTek Helio G35 8 nhân,4 nhân 2.3 GHz & 4 nhân 1.8 GHz,,4GB, 64GB,,"<div class=""ctLeft"">
<p>Kích thước, khối lượng:</p>
</div>
<div class=""ctRight""><span class="""">Dài 163.6 mm - Ngang 75.7 mm - Dày 8.4 mm - Nặng 193 g</span></div>",,,,193g,6.5 inch,IPS LCD,,,"<p>Điện Thoại Oppo A55 4GB/64GB - Hàng Chính Hãng</p>
<p>Bộ sản phẩm bao gồm: Thân máy, bộ sạc, cáp USB, dụng cụ lấy sim, sách hướng dẫn, ốp lưng điện thoại.</p>",3.5 mm,2,Nano SIM,Khung & Mặt lưng nhựa,Type-C,,"Dual-band (2.4 GHz/5 GHz),  Wi-Fi 802.11 a/b/g/n/ac,  Wi-Fi Direct  Wi-Fi hotspot",
189,192172856,25643.0,OPPO,Điện Thoại OPPO A16K (4GB/64GB) - Hàng Chính Hãng,A16K 4GB/64GB,dien-thoai-oppo-a16k-4gb-64gb-hang-chinh-hang-p192172856,4290000,,62.0,,Li-Po,5.0,,,,MicroSD,,Tối đa 1 TB,MediaTek Helio G35 8 nhân,4 nhân 2.3 GHz &amp; 4 nhân 1.8 GHz,,,,-,"<table style=""height:28px;"" border=""0"" width=""257"" cellspacing=""0"" cellpadding=""0""><tbody><tr style=""height:20px;""><td class=""xl71"" style=""height:20px;width:251.667px;"">164 x 75.4 x 7.85 mm </td>
</tr></tbody></table>",,,,175g,6.52 inch,IPS LCD,HD+ (700 x 1600 pixels),,"<p>Bộ sản phẩm bao gồm: Thân máy, sạc, cáp USB, dụng cụ lấy sim, vỏ bảo vệ, sách hướng dẫn.</p>",3.5 mm,2,Nano SIM,Khung nhựa  &amp; Mặt lưng thuỷ tinh hữu cơ,Micro USB,,"Dual-band (2.4 GHz/5 GHz), Wi-Fi 802.11 a/b/g/n/ac",
190,141529940,247549.0,Realme,Điện Thoại Realme C21Y 4GB/64GB - Hàng Chính Hãng,Realme C21Y 4GB/64GB,dien-thoai-realme-c21y-4gb-64gb-hang-chinh-hang-p141529940,4290000,,312.0,,Li-Po,v5.0,,,,MicroSD,, Tối đa 256 GB,Spreadtrum T610 8 nhân,1.8 GHz,,,,,"<div class=""ctLeft"">
<p>Kích thước, khối lượng:</p>
</div>
<div class=""ctRight""><span class="""">Dài 164.5 mm - Ngang 76 mm - Dày 9.1 mm - Nặng 194 g</span></div>",,,,194g,6.5 inch,IPS LCD,,,"<p>Điện Thoại Realme C21Y 4GB/64GB - Hàng Chính Hãng</p>
<p>Bộ sản phẩm bao gồm: Thân máy, sạc USB, dụng cụ lấy sim, sách hướng dẫn sử dụng.</p>",3.5mm,2,Nano SIM,Khung & Mặt lưng nhựa,Micro USB,,"Wi-Fi 802.11 b/g/n , Wi-Fi Direct,  Wi-Fi hotspot",
191,179930704,19673.0,Nokia,Điện Thoại Nokia C21 Plus (3GB/64GB) - Hàng Chính Hãng,,dien-thoai-nokia-c21-plus-3gb-64gb-hang-chinh-hang-p179930704,2999000,24,137.0,5050 mAh,Li-ion,v4.2,,," HDR, Toàn cảnh (Panorama)",MicroSD,,,Spreadtrum SC9863A 8 nhân,4 nhân 1.6 GHz &amp; 4 nhân 1.2 GHz,IMG PowerVR GE8322,3GB,64GB,,Dài 163.6 mm - Ngang 74 mm - Dày 8.3 mm,,,,193g,6.52 inch,,HD+ (700 x 1600 pixels),Có,,3.5mm,2,Nano Sim,,Micro USB,,Wi-Fi 802.11 a/b/g/n,Trung Quốc
192,147426081,247549.0,Realme,Điện thoại Realme C21y 3-32GB đen caro - Hàng Chính Hãng,,dien-thoai-realme-c21y-3-32gb-den-caro-hang-chinh-hang-p147426081,3510000,,291.0,,,,,,,,,,,,,,,,,,,,,,,,,,,,,,,,,
193,197605784,18802.0,Samsung,Điện Thoại Samsung Galaxy Z Fold 4 - Hàng Chính Hãng,Galaxy Z Fold,dien-thoai-samsung-galaxy-z-fold-4-hang-chinh-hang-p197605784,40990000,,13.0,,,v5.2,,,,,,,Snapdragon 8+ Gen 1 8 nhân,"1 nhân 3.18 GHz, 3 nhân 2.7 GHz &amp; 4 nhân 2 GHz",,,,,,,,,263g,,Dynamic AMOLED 2X,,,,Type - C,2,1 Nano SIM &amp; 1 E-SIM,Khung nhôm &amp; Mặt lưng kính cường lực,Type - C,,"Wi-Fi 802.11 a/b/g/n/ac/ax , Wi-Fi MIMO",
194,150735429,198543.0,Nubia,Điện Thoại Chuyên Game Nubia Redmagic 6R - Hàng Nhập Khẩu - Có Tiếng Việt,,dien-thoai-chuyen-game-nubia-redmagic-6r-hang-nhap-khau-co-tieng-viet-p150735429,15990000,,277.0,,,,,,,,,,,,,,,,,,,,,,,,,,,,,,,,,
195,179930699,19673.0,Nokia,Điện Thoại Nokia C21 Plus (3GB/32GB) - Hàng Chính Hãng,,dien-thoai-nokia-c21-plus-3gb-32gb-hang-chinh-hang-p179930699,2890000,17,137.0,5050 mAh,Li - ion, v4.2,,," HDR, Toàn cảnh (Panorama)",MicroSD,,,Spreadtrum SC9863A 8 nhân,4 nhân 1.6 GHz &amp; 4 nhân 1.2 GHz,IMG PowerVR GE8322,3GB,32GB,,Dài 163.6 mm - Ngang 74 mm - Dày 8.3 mm,,,,193g,6.52 inch,,HD+ (700 x 1600 pixels),Có,,3.5mm,2,Nano Sim,,Micro USB,,Wi-Fi 802.11 a/b/g/n,Trung Quốc
196,125595055,19673.0,Nokia,Điện thoại Nokia C20 2GB/32GB - Hàng chính hãng,,dien-thoai-nokia-c20-2gb-32gb-hang-chinh-hang-p125595055,1990000,2,367.0,2950 mAh,,,,,,,,,,,,2 GB,"32 GB e-MMC 5.1, hỗ trợ thẻ nhớ ngoài 64GB","RAM: 2 GB DDR3 DRAM  ROM: 32 GB e-MMC 5.1, hỗ trợ thẻ nhớ ngoài 64GB",,,,,Trọng lượng 191g,6.5 inch,,,,<p>Gói bán hàng Nokia C20 gồm có:<br />Nokia C20<br />Sách HDSD nhanh<br />Sạc (5V/1A)<br />Cáp USB Micro<br />Ốp silicon<br />Miếng dán màn hình<br />Tai nghe</p>,,,2 sim Nano + MicroSD,,5V1A,,,Phần Lan
197,197966909,18802.0,Samsung,Điện Thoại Samsung A04s 4GB/64GB - Hàng Chính Hãng,Samsung A04s 4GB/64GB,dien-thoai-samsung-a04s-4gb-64gb-hang-chinh-hang-p197966909,3990000,,6.0,5000mAh,Li-Po, v5.0,,,,MicroSD,,Tối đa 1 TB,Exynos 850 8 nhân,2.0 GHz 2.0 GHz,Mali-G52,4GB,64GB,,<p>Dài 164.7mm - Ngang 76.7mm - Dày 9.1mm - Nặng 195g</p>,,,,195g,6.5 inch,IPS LCD,HD+ (720 x 1600 pixels),,"<p>Bộ sản phẩm bao gồm: Thân máy, bộ sạc, dụng cụ lấy sim, sách hướng dẫn.</p>",3.5 mm,2,Nano SIM,Khung &amp; Mặt lưng nhựa,Type-C,,Dual-band (2.4 GHz/5 GHz)  Wi-Fi 802.11 a/b/g/n/ac  Wi-Fi Direct,
198,162033655,52232.0,Vivo,Điện Thoại Vivo Y15s 3GB/32GB - Hàng Chính Hãng,Vivo Y15s,dien-thoai-vivo-y15s-3gb-32gb-hang-chinh-hang-p162033655,3690000,1,225.0,5000 mAh,Li-Po,v5.0,,,,,,,MediaTek Helio P35 8 nhân,2.3 GHz, IMG PowerVR GE8320,3GB,32GB,,<p>Dài 163.96 mm - Ngang 75.2 mm - Dày 8.28 mm - Nặng 179 g</p>,,,,179 g,,IPS LCD,HD+ (700 x 1600 pixels),,"<p>Bộ sản phẩm bao gồm: Thân máy, bộ sạc, cáp USB, dụng cụ lấy sim, sách hướng dẫn, ốp lưng điện thoại.</p>",3.5 mm,2,Nano,Khung & Mặt lưng nhựa Polymer cao cấp,Micro USB,,Dual-band (2.4 GHz/5 GHz) Wi-Fi 802.11 a/b/g/n/ac Wi-Fi Direct Wi-Fi hotspot,
199,194041977,18802.0,Samsung,Điện thoại Samsung Galaxy Z Fold 4 (12GB/512GB) - Hàng chính hãng,,dien-thoai-samsung-galaxy-z-fold-12gb-512gb-hang-chinh-hang-p194041977,44490000,3,48.0,,,,,,,,,,,,,,,,,,,,,,,,,,,,,,,,,
200,190702241,18802.0,Samsung,Điện thoại Samsung A73 8GB/128GB Xám - Hàng chính hãng,A336 A736,dien-thoai-samsung-a73-8gb-128gb-xam-hang-chinh-hang-p190702241,11990000,,77.0,,,,,,,,,,,,,8 GB,,,,,,,,,,,,,,,,,,,,
201,193207578,18802.0,Samsung,Điện thoại Samsung Galaxy Z Fold 4 5G 512GB Đen - Hàng chính hãng,F936,dien-thoai-samsung-galaxy-z-fold-4-5g-512gb-den-hang-chinh-hang-p193207578,44490000,,56.0,,,,,,,,,,,,,,,,,,,,,,,,,,,,,,,,,Việt Nam
202,197497444,25643.0,OPPO,Điện Thoại Oppo Reno8 Z 5G 8GB/256GB - Hàng Chính Hãng,Reno8 Z 5G 8GB/256GB,dien-thoai-oppo-reno8-z-5g-8gb-256gb-hang-chinh-hang-p197497444,10490000,,14.0,4500 mAh,Li-Po,v5.1,,,,MicroSD,,Tối đa 1 TB,Snapdragon 695 5G 8 nhân,2.2 GHz,Adreno 619,8GB,256GB,,<p>Dài 159.9mm - Ngang 73.2mm - Dày 7.66mm - Nặng 181g</p>,,,,181g,6.43 inch,AMOLED,Full HD+ (1080 x 2400 Pixels),,"<p>Bộ sản phẩm bao gồm: Thân máy, sạc, cáp USB, dụng cụ lấy sim, vỏ bảo vệ, sách hướng dẫn.</p>",3.5 mm,2,Nano SIM,Khung nhựa &amp; Mặt lưng kính,Type-C,,Wi-Fi 802.11 a/b/g/n/acDual-band (2.4 GHz/5 GHz),
203,192839231,18802.0,Samsung,Điện Thoại Samsung Galaxy S22 5G (8GB/128GB) - Hàng Chính Hãng,,dien-thoai-samsung-galaxy-s22-5g-8gb-128gb-hang-chinh-hang-p192839231,19990000,,60.0,,,,,,,,,,,,,,,,,,,,,,,,,,,,,,,,,Việt Nam
204,162593187,18802.0,Samsung,Điện thoại Samsung Galaxy S22 Ultra 5G (12GB/512GB) - Hàng Chính Hãng,,dien-thoai-samsung-galaxy-s22-ultra-5g-12gb-512gb-hang-chinh-hang-p162593187,36990000,29,222.0,,,,,,,,,,,,,,,,,,,,,,,,,,,,,,,,,
205,158959446,25643.0,OPPO,Điện thoại Oppo A95 - RAM 8GB/SẠC-  Hàng Chính Hãng,Oppo A95,dien-thoai-oppo-a95-ram-8gb-sac-nhanh-pin-khung-bao-hanh-chinh-hang-p158959446,7030000,1,98.0,5000mAh,,,,,,,,,,,,,,,<p>16x7.4x8.3(cm)</p>,,,,,,,,,,,,,,,,,Việt Nam
206,188878527,19673.0,Nokia,Điện thoại Nokia G21 4GB/128GB Tím Cực Quang - Hàng Chính Hãng,NOKIAG21(4+128G),dien-thoai-nokia-g21-4gb-128gb-tim-cuc-quang-hang-chinh-hang-p188878527,4290000,1,89.0,5050 mAh, Li-Ion,có,,,có,,,,Unisoc T606 8 nhân,1.6 GHz,Mali-G57,4gb,128gb,128GB,,,,,190 g,6.5 inch,TFT LCD,HD+ (720 x 1600 pixels),có,,3.5 mm,2,Nano,,Type-C,có,có,Trung Quốc
207,179554879,25422.0,Xiaomi,"Điện thoại XIAOMI X4 PRO 5G 6.67""/SNAP695 5G/8G/256G/108+8+2MP/16MP/5000mAh",X4 Pro ,dien-thoai-poco-x4-pro-5g-6gb-128gb-8gb-256gb-hang-chinh-hang-p179554879,8990000,4,133.0,5000mAh,,,,,,,,,SnapDragon 695,,,6GB/8GB,128GB/256GB,128GB/256GB,,,,,,6.67 inch,AMOLED,Full HD+ (1080 x 2400 Pixels),,,,2,Nano sim,,Type C,,,Trung Quốc
208,171121228,18802.0,Samsung,Điện thoại Samsung Galaxy S22 Ultra 5G 12GB/256GB - Hàng chính hãng - ĐÃ KÍCH HOẠT BẢO HÀNH ĐIỆN TỬ,S22 Ultra ,dien-thoai-samsung-galaxy-s22-ultra-5g-12gb-256gb-hang-chinh-hang-da-kich-hoat-bao-hanh-dien-tu-p171121228,33990000,,188.0,,Li-Ion, v5.2,,,,,,,Snapdragon 8 Gen 1 8 nhân,"1 nhân 3 GHz, 3 nhân 2.5 GHz & 4 nhân 1.79 GHz",,,,,<p>Dài 163.3 mm - Ngang 77.9 mm - Dày 8.9 mm - Nặng 228 g</p>,,,,228 g,6.8 inch, Dynamic AMOLED 2X,,,"<p>Bộ sản phẩm gồm: Hộp, Sách hướng dẫn, Bút cảm ứng, Cây lấy sim, Cáp Type C</p>", Type-C,2,Nano, Khung kim loại & Mặt lưng kính, Type-C,, Dual-band (2.4 GHz/5 GHz)  Wi-Fi 802.11 a/b/g/n/ac/ax  Wi-Fi Direct  Wi-Fi hotspot,
209,186243828,25643.0,OPPO,Điện thoại OPPO Reno7 4G (8GB/128GB) - Hàng Chính Hãng,Reno7 4G,dien-thoai-oppo-reno7-4g-8gb-128gb-hang-chinh-hang-p186243828,8990000,,74.0,4500 mAh,Li-Po," LE, v5.1",,,,MicroSD,,1 TB,Snapdragon 680 8 nhân, 2.4 GHz,,,,115 GB,<p>Dài 159.9 mm - Ngang 73.2 mm - Dày 7.54 mm</p>,,,,175 g,6.43 inch,AMOLED,,,"<p>Bộ sản phẩm gồm: Hộp, Sách hướng dẫn, Cây lấy sim, Ốp lưng, Cáp Type C, Củ sạc nhanh rời đầu Type A</p>",3.5 mm,2,Nano SIM,Khung nhựa &amp; Mặt lưng thuỷ tinh hữu cơ,,," Dual-band (2.4 GHz/5 GHz), Wi-Fi 802.11 a/b/g/n/ac",
210,145905253,52232.0,Vivo,Điện thoại di động Vivo Y21s (4+128GB) xanh - Hàng Chính Hãng,,dien-thoai-di-dong-vivo-y21s-4-128gb-xanh-p145905253,5490000,,294.0,,,,,,,,,,,,,,,,,,,,,,,,,,,,,,,,,
211,159887243,18802.0,Samsung,Điện Thoại Samsung Galaxy Z Flip3 5G 8GB/128GB - Hàng Chính Hãng ,Samsung Galaxy Z Flip,dien-thoai-galaxy-z-flip3-5g-8gb-128gb-p159887243,22250000,36,248.0,3300mAh,,,,,,,,,,,,8GB,,,,,,,,,,,,,,,,,,,,Việt Nam
212,159887161,18802.0,Samsung,Điện thoại Samsung Galaxy A22 LTE 6GB/128GB - Hàng chính hãng chưa active,Samsung Galaxy A22 LTE,dien-thoai-galaxy-a22-lte-6gb-128gb-hang-chinh-hang-chua-active-p159887161,5850000,,248.0,5000mAh,,,,,,,,,,,,6GB,,,,,,,,,,,,,,,,,,,,Việt Nam
213,124877310,18802.0,Samsung,Điện thoại Samsung Galaxy A22 (6GB/128GB) - Hàng chính hãng- Đã kích hoạt bảo hành điện tử,Galaxy A22,dien-thoai-samsung-galaxy-a22-6gb-128gb-hang-chinh-hang-da-kich-hoat-bao-hanh-dien-tu-p124877310,5490000,,362.0,,Li-Po,,,,,1 TB,,,MediaTek MT6769V 8 nhân,4 nhân 2.0 GHz & 4 nhân 1.8 GHz,,,,103 GB,<p>Dài 159.3 mm - Ngang 73.6 mm - Dày 8.4 mm</p>,,,,186 g,6.4 inch,Super AMOLED,HD+ (720 x 1600 pixels),,"<p>Hộp, Sách hướng dẫn, Cây lấy sim, Cáp Type C, Củ sạc rời đầu Type A</p>",3.5mm,2,Nano,Khung & Mặt lưng nhựa,Type-C,,Wi-Fi hotspot  Dual-band (2.4 GHz/5 GHz)  Wi-Fi Direct  Wi-Fi 802.11 a/b/g/n/ac,
214,172001933,18802.0,Samsung,Điện Thoại Samsung A03 Core 2GB/32GB - Hàng Chính Hãng,Samsung A03 core,dien-thoai-samsung-a03-core-2gb-32gb-hang-chinh-hang-p172001933,2690000,8,185.0,5000 mah,,Có,,,,,,,Unisoc T606 8 nhân,4 nhân 1.6 GHz & 4 nhân 1.2 GHz,,,,32GB,,,,,,,,,Có ,"<table>
<tbody>
<tr>
<td>
<p>Bộ sản phẩm bao gồm: Thân máy, sạc, cáp dữ liệu, tài liệu hướng dẫn, dụng cụ lấy sim, sách hướng dẫn.</p>
</td>
</tr>
</tbody>
</table>",,2,,,,,Có,Hàn Quốc
215,171254543,229213.0,Bphone,Điện thoại thông minh Bphone A50 - Hàng chính hãng,A50,dien-thoai-thong-minh-bphone-a50-hang-chinh-hang-p171254543,5490000,10,188.0,5000mAh,Lithium - Ion Polymer,5.0,,,"Bộ 4 camera chính kết hợp cùng các sáng tạo công nghệ nhiếp ảnh điện toán nổi bật. Chụp Smacro với độ nét cao, chụp đêm sNight, chụp chân dung xóa phông, chụp góc rộng... cho hình ảnh trung thực, sắc nét",MicroSD hỗ trợ tới 256GB,,MicroSD hỗ trợ tới 256GB,Mediatek Helio G85,,Mali-G52,4GB,128GB,128GB,"<p>75,8 x 150,6 x 7,6 mm</p>",,,,203g,6.67 inch,,Full HD+ (2160 x 1080 pixels),có,"<p>Cáp sạc, củ sạc, ớp lưng, miến dán màn hình, que chọc sim, sách hướng dẫn</p>",3.5,2,Nano sim,,Type C,,"2.4GHZ, 5GHZ 802.11ac/a/b/g/n",Việt Nam
216,164436745,52232.0,Vivo,Điện thoại Vivo Y21 4GB/64GB Xanh Tím - Hàng Chính Hãng,Y21 (V2111),dien-thoai-vivo-y21-4gb-64gb-xanh-tim-hang-chinh-hang-p164436745,3990000,,210.0,5000mAh,Li-Po,Bluetooth 5.0,,,Có,MicroSD,,"MicroSD, hỗ trợ tối đa 1 TB",Mediatek Helio P35,,,4GB,64GB,64GB,,,,,182 gr,, IPS LCD,HD+ (720 x 1600 pixels),Có,<p>Hộp</p>,3.5 mm,2,Nano SIM,,Type-C,Có,2.4GHz / 5GHz,Trung Quốc
217,179159226,52232.0,Vivo,Điện Thoại Vivo T1 5G (8GB/128GB) - Hàng Chính Hãng,,dien-thoai-vivo-t1-5g-8gb-128gb-hang-chinh-hang-p179159226,7990000,15,140.0,4700mAh,,v5.2,,,"Chụp đêm, Chân dung, Chụp ảnh, Quay video, 64MP, Chụp toàn cảnh, Live Photo, Quay chuyển động chậm, Quay tua nhanh thời gian, Chuyên nghiệp, AR Stickers, DOC, Video hiện thị kép",,,,Qualcomm Snapdragon 778G 5G ,,,8GB,128GB,,,,,,180.3g,6.44 inch,AMOLED,,,"Sách hướng dẫn, cây lấy sim, cáp",,2 sim,,,USB Type-C,Có,2.4GHz /5GHz,Trung Quốc
218,161158099,49994.0,ZTE,Điện Thoại ZTE Blade A51 3GB l 64GB - Hàng Chính Hãng,A31,dien-thoai-zte-blade-a51-3gb-l-64gb-hang-chinh-hang-p161158099,2690000,1,230.0,,,,,,,,,,,,,,,,,,,,0.2,6 inch,,HD+ (720 × 1480 Pixels),,<p>Điện Thoại + Sách hướng dẫn + Bộ cáp sạc</p>,3.5mm,2,nano,,Type C,,,
219,172178476,18802.0,Samsung,Điện Thoại Samsung A23 4GB/128GB - Hàng Chính Hãng,A23 4GB/128GB,dien-thoai-samsung-a23-4gb-128gb-hang-chinh-hang-p172178476,5690000,13,183.0,5000 mAh,Li-Po,v5.0,,,,MicroSD,,Tối đa 1 TB,Snapdragon 680 8 nhân, 4 nhân 2.4 GHz & 4 nhân 1.9 GHz,Adreno 610,4GB,128GB,,<p>Dài 165.4 mm - Ngang 76.9 mm - Dày 8.4 mm - Nặng 195 g</p>,,,,195 g,6.6 inch, IPS LCD,,Có,"<p style=""margin:0in;margin-bottom:0.0001pt;line-height:150%;background:white;vertical-align:baseline"">Bộ sản phẩm bao gồm: Thân máy, sạc, cáp dữ liệu, tài liệu hướng dẫn, dụng cụ lấy sim và lấy thẻ nhớ.</p>",3.5 mm,2,Nano SIM,Nguyên khối,Type-C,,Dual-band (2.4 GHz/5 GHz)Wi-Fi Direct,
220,193207892,18802.0,Samsung,Điện thoại Samsung Galaxy Z Flip 4 5G 128GB Tím - Hàng chính hãng,F721,dien-thoai-samsung-galaxy-z-flip-4-5g-128gb-tim-hang-chinh-hang-p193207892,23990000,,56.0,,,,,,,,,,,,,,,,,,,,,,,,,,,,,,,,,Việt Nam
221,192172856,25643.0,OPPO,Điện Thoại OPPO A16K (4GB/64GB) - Hàng Chính Hãng,A16K 4GB/64GB,dien-thoai-oppo-a16k-4gb-64gb-hang-chinh-hang-p192172856,4290000,,62.0,,Li-Po,5.0,,,,MicroSD,,Tối đa 1 TB,MediaTek Helio G35 8 nhân,4 nhân 2.3 GHz &amp; 4 nhân 1.8 GHz,,,,-,"<table style=""height:28px;"" border=""0"" width=""257"" cellspacing=""0"" cellpadding=""0""><tbody><tr style=""height:20px;""><td class=""xl71"" style=""height:20px;width:251.667px;"">164 x 75.4 x 7.85 mm </td>
</tr></tbody></table>",,,,175g,6.52 inch,IPS LCD,HD+ (700 x 1600 pixels),,"<p>Bộ sản phẩm bao gồm: Thân máy, sạc, cáp USB, dụng cụ lấy sim, vỏ bảo vệ, sách hướng dẫn.</p>",3.5 mm,2,Nano SIM,Khung nhựa  &amp; Mặt lưng thuỷ tinh hữu cơ,Micro USB,,"Dual-band (2.4 GHz/5 GHz), Wi-Fi 802.11 a/b/g/n/ac",
222,194125248,52232.0,Vivo,Điện thoại Vivo Y02s  (3GB/32GB) - Hàng Chính Hãng,,dien-thoai-vivo-y02s-3gb-32gb-hang-chinh-hang-p194125248,3490000,,46.0, 5000 mAh, Li-Ion,v5.0,,,"Làm đẹp  Trôi nhanh thời gian (Time Lapse)  Xóa phông, Quay video HD",,,hỗ trợ tối đa 1 TB,MediaTek Helio P35 8 nhân, 4 nhân 2.3 GHz &amp; 4 nhân 1.8 GHz, IMG PowerVR GE8320,3 GB,32 GB,20 GB,,,,,182 g,6.5 inch, IPS LCD,HD+ (720 x 1600 pixels),có,"<p>Sách hướng dẫn, dây sạc, củ sạc, ốp lưng</p>",3.5 mm,2, 2 Nano SIM, Khung &amp; Mặt lưng nhựa Polymer cao cấp,Type-C,, Dual-band (2.4 GHz/5 GHz),Trung Quốc
223,164433441,52232.0,Vivo,Điện thoại Vivo Y15s 3GB/32GB Xanh Đen - Hàng Chính Hãng,Y15s (V2120),dien-thoai-vivo-y15s-3gb-32gb-xanh-den-hang-chinh-hang-p164433441,3490000,,210.0,5000mAh, Li-Po,Bluetooth 5.0,,,Có,,,,MediaTek Helio P35,,,3GB,32GB,,,,,,179gr,6.5 inch,LCD (IPS),HD+ (720 x 1600 pixels),Có,<p>Hộp</p>,,2,,,,,2.4GHz /5GHz,Trung Quốc
224,175167498,18802.0,Samsung,Điện Thoại Samsung Galaxy A22 LTE 128GB | 6GB - Hàng Chính Hãng,,dien-thoai-samsung-galaxy-a22-lte-128gb-6gb-p175167498,4830000,2,161.0,,Li-Po,A2DP v5.0 LE,,,,,,,,4 nhân 2.0 GHz &amp; 4 nhân 1.8 GHz,,6GB,,,,,,,,,Super AMOLED,HD+ (720 x 1600 pixels),,,3.5 mm,,Nano SIM,,Type-C,,,
225,172329599,25422.0,Xiaomi,Điện thoại Xiaomi Redmi 9A (2GB/32GB) - Hàng chính hãng,Redmi 9A,dien-thoai-xiaomi-redmi-9a-2gb-32gb-hang-chinh-hang-p172329599,2199000,13,182.0,,,Có,,,,,,,MediaTek Helio G25 (12 nm),8 nhân 2.0 GHz,,,,32GB,,,,,,,,,,"<table>
<tbody>
<tr>
<td>Cáp, sạc, sách hướng dẫn</td>
</tr>
</tbody>
</table>",,2,2 Nano SIM,,,,,
226,119421964,18802.0,Samsung,Điện Thoại Samsung Galaxy A03s LTE (4GB/64GB) - ĐÃ KÍCH HOẠT ĐIỆN TỬ - Hàng Chính Hãng,SM-A037,dien-thoai-samsung-galaxy-a03s-lte-4gb-64gb-da-kich-hoat-dien-tu-hang-chinh-hang-p119421964,3690000,37,399.0,5000mAh, Li-Po,"A2DP, LE, v4.2",,,,MicroSD,,"MicroSD, hỗ trợ tối đa 1 TB",MediaTek MT6765 8 nhân,4 nhân 2.3 GHz & 4 nhân 1.8 GHz, IMG PowerVR GE8320,4GB,64GB,54GB,<p>Dài 164 mm - Ngang 7.6 mm - Dày 9.1 mm</p>,,,,196 g,6.5 inch,PLS LCD,HD+ (720 x 1600 pixels),Có,"<p>Hộp, Sách hướng dẫn, Cây lấy sim, Cáp Type C, Củ sạc rời đầu Type A</p>", 3.5 mm, 2 Nano SIM,Nano,Khung & Mặt lưng nhựa, Type-C,, Wi-Fi 802.11 b/g/nWi-Fi hotspot,
227,83368040,18802.0,Samsung,Điện Thoại Samsung Galaxy A52 (8GB/128GB) - Hàng Chính Hãng,,dien-thoai-samsung-galaxy-a52-8gb-128gb-hang-chinh-hang-p83368040,9290000,34,559.0, 4500 mAh, Lithium polymer, v5.0,,,,Có,,1TB,Snapdragon 720G 8 nhân, 2.30 GHz,Adreno 618,8GB,128GB,,<p>Dài 159.9 mm - Ngang 75.1 mm - Dày 8.1 mm</p>,,,, 209 g,6.5 inch, Super AMOLED,Full HD+ (1080 x 2400 Pixels),Có,"Sách hướng dẫn, cây lấy sim, cáp",3.5mm,2,Nano SIM,,Type-C,,"Wi-Fi 802.11 a/b/g/n/ac, Wi-Fi Direct, Wi-Fi hotspot",Việt Nam/Ấn Độ/Trung Quốc (Tùy từng đợt nhập hàng)
228,185225486,111684.0,Itel,"Điện thoại itel Vision 2 3GB/64GB l Pin 4000mAh l Màn hình 6.6"" l Chip Octa 1.6GHz l Camera Triple Al 13MP - Hàng chính hãng",,dien-thoai-itel-vision-2-3gb-64gb-l-pin-4000mah-l-man-hinh-6-6-l-chip-octa-1-6ghz-l-camera-triple-al-13mp-chinh-hang-p185225486,2900000,,111.0,,,,,,,,,,,,,,,,,,,,,,,,,,,,,,,,,
229,178951652,18802.0,Samsung,Điện Thoại Samsung Galaxy A53 5G (8GB/128GB) - ĐÃ KÍCH HOẠT ĐIỆN TỬ - Hàng Chính Hãng,SM-A53,dien-thoai-samsung-galaxy-a53-5g-8gb-128gb-da-kich-hoat-dien-tu-hang-chinh-hang-p178951652,9990000,6,140.0, 5000 mAh, Li-Ion, v5.1,,,,MicroSD,,1 TB, Exynos 1280 8 nhân, 2 nhân 2.4 GHz &amp; 6 nhân 2 GHz, Mali-G68,8GB,128GB,,<p>Dài 159.6 mm - Ngang 74.8 mm - Dày 8.1 mm</p>,,,,189 g,6.5 inch, Super AMOLED,,,"<p> Hộp, Sách hướng dẫn, Cây lấy sim, Cáp Type C</p>",Type-C, 2 Nano SIM (SIM 2 chung khe thẻ nhớ),Nano SIM, Khung &amp; Mặt lưng nhựa, Type-C,," Dual-band (2.4 GHz/5 GHz), Wi-Fi 802.11 a/b/g/n/ac,  Wi-Fi Direct,  Wi-Fi hotspot",Việt Nam
230,195323206,52232.0,Vivo,Điện thoại vivo Y22s (8GB - 128GB) - Hàng Chính Hãng,Y22s,dien-thoai-vivo-y22s-8gb-128gb-hang-chinh-hang-p195323206,5990000,,40.0,5000mAh (TYP),,Bluetooth 5.0,,,"Chụp đêm (trước và sau), Chân dung, Chụp ảnh, Quay video, Độ phân giải cao, Chụp toàn cảnh, Live Photo, Quay chuyển động chậm, Quay tua nhanh thời gian, Chế độ chuyên nghiệp, DOC",,,,Qualcomm Snapdragon 680,,,8GB,128GB,128,<p>164.30×76.10×8.38mm</p>,,,,192g,6.55 inch,LCD,HD+ (720 x 1600 pixels),Có,"<p>Y22s, Sách hướng dẫn, Dây USB, Củ sạc USB, Que lấy SIM, Ốp lưng, Miếng dán màn hình (dán sẵn)</p>",,2,Nano SIM,Polymer cao cấp 2.5D,Type C,MP4,2.4GHz /5GHz,Trung Quốc
231,147426081,247549.0,Realme,Điện thoại Realme C21y 3-32GB đen caro - Hàng Chính Hãng,,dien-thoai-realme-c21y-3-32gb-den-caro-hang-chinh-hang-p147426081,3510000,,291.0,,,,,,,,,,,,,,,,,,,,,,,,,,,,,,,,,
232,197605784,18802.0,Samsung,Điện Thoại Samsung Galaxy Z Fold 4 - Hàng Chính Hãng,Galaxy Z Fold,dien-thoai-samsung-galaxy-z-fold-4-hang-chinh-hang-p197605784,40990000,,13.0,,,v5.2,,,,,,,Snapdragon 8+ Gen 1 8 nhân,"1 nhân 3.18 GHz, 3 nhân 2.7 GHz &amp; 4 nhân 2 GHz",,,,,,,,,263g,,Dynamic AMOLED 2X,,,,Type - C,2,1 Nano SIM &amp; 1 E-SIM,Khung nhôm &amp; Mặt lưng kính cường lực,Type - C,,"Wi-Fi 802.11 a/b/g/n/ac/ax , Wi-Fi MIMO",
