,id,brand_id,brand_name,name,model,url_key,price,quantity_sold,create_at,battery_capacity,battery_type,bluetooth,camera_back,camera_front,camera_feature,card_slot,card_type,card_up_to,chipset,cpu,gpu,ram,storage_capacity,storage_capacity2,dimensions,height,width,deep,weight,display_size,display_type,display_resolution,network_4g,accessories,headphone_jack,sim_slot,sim_type,material,charge_port,recording,wifi,made_in
0,132068858,25643.0,OPPO,Điện Thoại Oppo A55 (4GB/64GB) - Hàng Chính Hãng,,dien-thoai-oppo-a55-4gb-64gb-hang-chinh-hang-p132068858,4990000,11931,341.0, 5000 mAh, Li-Po,Có,,," AI Camera , Ban đêm (Night Mode)  ,Chuyên nghiệp (Pro) , Chạm lấy nét,  HDR  ,Làm đẹp,  Nhận diện khuôn mặt  ,Tự động lấy nét (AF) , Xóa phông",MicroSD,,Hỗ trợ tối đa 256 GB, MediaTek Helio G35 8 nhân,4 nhân 2.3 GHz &amp; 4 nhân 1.8 GHz, IMG PowerVR GE8320,4GB, 64 GB,,Dài 163.6 mm - Ngang 74 mm - Dày 8.3 mm,,,,193g,6.5 inch," IPS LCD, Kính cường lực Dinorex Glass",HD+ (700 x 1600 pixels),Có,"Sạc, Sách HDSD",3.5 mm,2,Nano SIM, Khung &amp; Mặt lưng nhựa,Type-C, FullHD 1080p@30fpsHD 720p@30fps,"Dual-band (2.4 GHz/5 GHz),  Wi-Fi 802.11 a/b/g/n/ac,  Wi-Fi Direct,  Wi-Fi hotspot",Trung Quốc
1,142545270,25643.0,OPPO,Điện Thoại Oppo A16k (3GB/32G) - Hàng Chính Hãng,,dien-thoai-oppo-a16k-3gb-32g-hang-chinh-hang-p142545270,3190000,12824,308.0, 4230 mAh, Li-Po," A2DP,  apt-X,  LE,  v5.0",,," HDR, Toàn cảnh (Panorama)",,,, MediaTek MT6765 8 nhân,4 nhân 2.3 GHz & 4 nhân 1.8 GHz, IMG PowerVR GE8320,3GB, 32 GB,,Dài 163.6 mm - Ngang 74 mm - Dày 8.3 mm,,,,193g,6.52 inch, IPS LCD,HD+ (700 x 1600 pixels),Có,, 3.5 mm,2,Nano SIM,,Micro USB,Có,Có,Trung Quốc
2,133811136,25422.0,Xiaomi,Điện Thoại Xiaomi Redmi 9C 4GB/128GB - Hàng Chính Hãng,Điện Thoại Xiaomi Redmi 9C 4GB/128GB ,dien-thoai-xiaomi-redmi-9c-4gb-128gb-hang-chinh-hang-p133811136,3490000,1239,337.0,,Li-Ion,A2DP  LE  v5.0,,,,MicroSD,,	512 GB, MediaTek Helio G35 8 nhân,4 nhân 2.3 GHz & 4 nhân 1.8 GHz,,4GB,128GB,,<p>Dài 164.9 mm - Ngang 77.07 mm - Dày 9 mm - Nặng 196 g</p>,,,,196 g,6.53 inch,IPS LCD,HD+ (720 x 1600 pixels),,"<p>Bộ sản phẩm bao gồm: Pin, sạc, cáp USB, cây tháo sim, sách hướng dẫn.</p>",,2,Nano,Khung & Mặt lưng nhựa,Micro USB,,Wi-Fi 802.11 a/b/g/n  Wi-Fi Direct  Wi-Fi hotspot,
3,57809866,25422.0,Xiaomi,Điện thoại Xiaomi Redmi 9A (2GB/32GB) - Hàng chính hãng,Redmi 9A,dien-thoai-xiaomi-redmi-9a-2gb-32gb-hang-chinh-hang-p57809866,2490000,4451,811.0,	5000 mAh,	Pin chuẩn Li-Ion,"	A2DP, LE",,,"	Xoá phông, A.I Camera, Tự động lấy nét (AF), Chạm lấy nét, Nhận diện khuôn mặt, HDR",	MicroSD,,Hỗ trợ tối đa 512 GB,,	8 nhân 2.0 GHz,PowerVR GE8320,	2 GB,	32 GB,,<p>Dài 164.9 mm - Ngang 77.07 mm - Dày 9 mm</p>,,,,	194 g,6.53 inch,IPS LCD,HD+ (700 x 1600 pixels),Có,"Cáp, sạc, sách hướng dẫn",3.5 mm,,	2 Nano SIM,,	Micro USB,"	Quay phim HD 720p@30fps, Quay phim FullHD 1080p@30fps","	Wi-Fi 802.11 b/g/n, Wi-Fi Direct, Wi-Fi hotspot",Trung Quốc
4,113569117,25643.0,OPPO,Điện Thoại Oppo Reno 6Z 5G (8GB/128G) - Hàng Chính Hãng,,dien-thoai-oppo-reno-6z-5g-8gb-128g-hang-chinh-hang-p113569117,7490000,1348,437.0,4310mAh,,Có,,,,,,," MTK Dimensity 800U 5G, tối đa 2.4G",,Mali-G57 MC3,8GB,128GB,,Dài 163.6 mm - Ngang 74 mm - Dày 8.3 mm,,,,193g,6.43 inch, AMOLED,,Có,Sách hướng dẫn,,,,,,,Có,Trung Quốc
5,128865871,18802.0,Samsung,Điện Thoại Samsung Galaxy M32 (8GB/128GB) - Hàng Chính Hãng - Đã kích hoạt bảo hành điện tử,M32,dien-thoai-samsung-galaxy-m32-8gb-128gb-hang-chinh-hang-da-kich-hoat-bao-hanh-dien-tu-p128865871,5990000,498,352.0,, Li-Ion,A2DP  LE  v5.0,,,,,,, MediaTek Helio G80 8 nhân, 2 nhân 2.0 GHz & 6 nhân 1.8 GHz,,,,,<p>Dài 160 mm - Ngang 74 mm - Dày 9 mm - Nặng 196 g</p>,,,,196 g,6.4 inch, Super AMOLED,Full HD+ (1080 x 2400 Pixels),,,3.5 mm,2,Nano,Khung & Mặt lưng nhựa,Type-C,,,
6,172998120,18802.0,Samsung,Điện thoại Samsung Galaxy M23 5G (6GB/128GB) - Hàng chính hãng,,dien-thoai-samsung-galaxy-m23-5g-6gb-128gb-hang-chinh-hang-p172998120,6890000,1977,181.0,,,,,,,,,,,,,,,,,,,,,,,,,,,,,,,,,
7,175967811,18802.0,Samsung,Điện Thoại Samsung Galaxy S20 FE 256GB | 8GB - Hàng Chính Hãng ,Galaxy S20 FE,dien-thoai-samsung-galaxy-s20-fe-256gb-8gb-hang-chinh-hang-p175967811,9950000,189,155.0,,Li-Ion,V5.0,,,"Lấy nét theo pha (PDAF), Xoá phông, Zoom quang học, Chạm lấy nét, Toàn cảnh (Panorama), Chống rung quang học (OIS), Làm đẹp (Beautify), Tự động lấy nét (AF), Nhận diện khuôn mặt, HDR, Zoom kỹ thuật số, Góc rộng (Wide), Góc siêu rộng (Ultrawide)",MicroSD,,,Snapdragon 865,"1 nhân 2.84 GHz, 3 nhân 2.42 GHz &amp; 4 nhân 1.8 GHz",Adreno 650,8GB,256 GB,221 GB,<p>Dài 159.8 mm - Ngang 74.5 mm - Dày 8.4 mm</p>,,,,,6.5 inch,Super AMOLED,Full HD+ (1080 x 2400 Pixels),,"<p>Hộp, Sạc, Sách hướng dẫn, Cây lấy sim, Cáp Type C</p>",3.5mm,2 (SIM 2 chung khe thẻ nhớ),Nano Sim,Khung nhôm &amp; Mặt lưng nhựa,USB Type-C,"4K 2160p@60fps, 4K 2160p@30fps, FullHD 1080p@30fps, FullHD 1080p@60fps","Wi-Fi 802.11 a/b/g/n/ac/ax, Wi-Fi MIMO, Wi-Fi hotspot, Dual-band (2.4 GHz/5 GHz), Wi-Fi Direct",
8,114766715,25643.0,OPPO,Điện Thoại Oppo A16 (4GB/64G) - Hàng Chính Hãng,,dien-thoai-oppo-a16-4gb-64g-hang-chinh-hang-p114766715,3990000,106,431.0,5000 mAh,,,,,,MicroSD,,256 GB,Helio G35 8 nhân,,,4GB,64GB,,Dài 163.6 mm - Ngang 74 mm - Dày 8.3 mm,,,,193g,6.52 inch,,HD+ (720 x 1600 pixels),,,,2,Nano Sim,,,,,Trung Quốc
9,194034217,18802.0,Samsung,Điện thoại Samsung Galaxy Z Flip 4 (8GB/128GB) - Hàng chính hãng,,dien-thoai-samsung-galaxy-z-flip-4-8gb-128gb-hang-chinh-hang-p194034217,23990000,7,48.0,,,,,,,,,,,,,,,,,,,,,,,,,,,,,,,,,
10,135332196,19673.0,Nokia,Điện Thoại Nokia C20 2GB/16GB - Hàng Chính Hãng,Nokia C20 2GB/16GB,dien-thoai-nokia-c20-2gb-16gb-hang-chinh-hang-p135332196,2290000,363,332.0,,Li-Ion,,,,,,,Tối đa 256 GB,Spreadtrum SC9863A 8 nhân,,,,,,"<div class=""ctLeft"">
<p>Kích thước, khối lượng:</p>
</div>
<div class=""ctRight""><span class="""">Dài 169.9 mm - Ngang 77.9 mm - Dày 8.8 mm - Nặng 191 g</span></div>",,,,191g,6.5 inch, IPS LCD,,,"<p>Điện Thoại Nokia C20 2GB/16GB - Hàng Chính Hãng</p>
<p>Bộ sản phẩm bao gồm: Thân máy, cáp micro USB, sạc, tai nghe, ốp silicon, sách hướng dẫn sử dụng.</p>",3.5 mm,2,Nano SIM,Khung & Mặt lưng nhựa Polycarbonate,Micro USB,,,
11,164937168,25643.0,OPPO,Điện Thoại Oppo A16k (4GB/64G) - Hàng Chính Hãng,A16k (4GB/64G),dien-thoai-oppo-a16k-4gb-64g-hang-chinh-hang-p164937168,3790000,8424,213.0,4230mAh ,,v5.0,,,,Có,,,"Helio G35 8 nhân, tối đa 2.3GHz",Tối đa 2.3GHz,IMG GE8320,4GB,64GB,,164 x 75.4 x 7.85 mm,,,,193g,,Corning Gorilla Glass 3,HD+ (720 x 1600 pixels),,Sách hướng dẫn,,2,Nano Sim,,,FullHD 1080p@30fpsHD 720p@30fps,"2.4G/5G, 802.11 a/b/g/n/ac",Trung Quốc
12,120295859,19673.0,Nokia,Điện Thoại Nokia C30 (2GB/32GB) - Hàng Chính Hãng,,dien-thoai-nokia-c30-2gb-32gb-hang-chinh-hang-p120295859,2290000,51,395.0,6000 mAh,Li-Po," A2DP, v4.2",,," Chạm lấy nét,  HDR,  Làm đẹp  Nhận diện khuôn mặt,  Toàn cảnh (Panorama),  Tự động lấy nét (AF),  Xóa phông",MicroSD,,256 GB,Spreadtrum SC9863A 8 nhân,4 nhân 1.6 GHz & 4 nhân 1.2 GHz,IMG PowerVR 8322,2GB,32GB,,<p>Dài 177.7 mm - Ngang 79.1 mm - Dày 9.9 mm</p>,,,,237 g,,IPS LCD,HD+ (720 x 1600 pixels),Có,"Sách hướng dẫn, cây lấy sim, cáp",3.5 mm,2,Nano SIM,, Micro USB,"FullHD 1080p@30fps, HD 720p@30fps","Wi-Fi 802.11 a/b/g/n, Wi-Fi hotspot",Trung Quốc
13,162593114,18802.0,Samsung,Điện thoại Samsung Galaxy S22 Ultra 5G (8GB/128GB) - Hàng Chính Hãng,S22 Ultra,dien-thoai-samsung-galaxy-s22-ultra-5g-8gb-128gb-hang-chinh-hang-p162593114,30990000,31,222.0,,,,,,,,,,,,,,,,,,,,,,,,,,,,,,,,,
14,159887168,18802.0,Samsung,Điện Thoại Samsung Galaxy S21 FE 5G RAM 8GB - Hàng chính hãng chưa active,Samsung Galaxy S21 FE,dien-thoai-galaxy-s21-fe-5g-ram-8gb-hang-chinh-hang-chua-active-p159887168,15990000,19,245.0,4500mAh,,,,,,,,,,,,8GB,,,,,,,,,,,,,,,,,,,,Việt Nam
15,158714974,18802.0,Samsung,Điện thoại Samsung Galaxy A03 (3GB/32GB) - Hàng chính hãng,A03 3GB/32GB,dien-thoai-samsung-galaxy-a03-3gb-32gb-hang-chinh-hang-p158714974,2990000,2266,255.0,	5000 mAh,,,,,,,,,	Unisoc T606,,,,,,,,,,,6.5 inch,,HD+ (720 x 1600 pixels),,,	Jack 3.5 mm,2,	Nano SIM,,,,,
16,102077313,18802.0,Samsung,Điện thoại Samsung Galaxy A32 (6GB/128GB) - Hàng Chính Hãng - Đã kích hoạt bảo hành điện tử,Galaxy A32,dien-thoai-samsung-galaxy-a32-6gb-128gb-hang-chinh-hang-da-kich-hoat-bao-hanh-dien-tu-p102077313,6990000,114,483.0,, Li-Ion, A2DP  LE  v5.0,,,,MicroSD,,1 TB, MediaTek Helio G80, 2 nhân 2.0 GHz & 6 nhân 1.8 GHz,,,,Khoảng 115 GB,<p>Dài 158.9 mm - Ngang 73.6 mm - Dày 8.4 mm</p>,,,,,6.4 inch,Super AMOLED,Full HD+ (1080 x 2400 Pixels),,"<p>Hộp, Sách hướng dẫn, Cây lấy sim, Cáp Type C, Củ sạc nhanh rời đầu Type A </p>",3.5 mm,2,Nano SIM, Khung & Mặt lưng nhựa, Type-C,,Dual-band (2.4 GHz/5 GHz)  Wi-Fi 802.11 a/b/g/n/ac  Wi-Fi Direct  Wi-Fi hotspot,
17,162593136,18802.0,Samsung,Điện thoại Samsung Galaxy S22 Ultra 5G (12GB/256GB) - Hàng Chính Hãng,,dien-thoai-samsung-galaxy-s22-ultra-5g-12gb-256gb-hang-chinh-hang-p162593136,33990000,54,222.0,,,,,,,,,,,,,,,,,,,,,,,,,,,,,,,,,
18,142545264,25643.0,OPPO,Điện Thoại Oppo A95 (8GB/128G) - Hàng Chính Hãng,,dien-thoai-oppo-a95-8gb-128g-hang-chinh-hang-p142545264,6990000,568,308.0, 5000 mAh,Li-Po,"A2DP,  LE,  v5.0",,," AI Camera,  Chuyên nghiệp (Pro),  HDR,  Lấy nét theo pha (PDAF),  Siêu cận (Macro),  Toàn cảnh (Panorama),  Trôi nhanh thời gian (Time Lapse),  Xóa phông", MicroSD,,256GB, Snapdragon 662 8 nhân, 4 nhân 2.0 GHz & 4 nhân 1.8 GHz, Adreno 610,8GB,128 GB,Khoảng 115 GB,Dài 163.6 mm - Ngang 74 mm - Dày 8.3 mm,,,,193g,6.43 inch,AMOLED,Full HD+ (1080 x 2400 Pixels),Có,, 3.5 mm,2,Nano SIM,Khung & Mặt lưng thủy tinh hữu cơ, Type-C,"FullHD 1080p@30fps, HD 720p@30fps","Dual-band (2.4 GHz/5 GHz),  Wi-Fi 802.11 a/b/g/n/ac,  Wi-Fi Direct,  Wi-Fi hotspot",Trung Quốc
19,88100671,18802.0,Samsung,Điện thoại Samsung Galaxy A32-Hàng Chính Hãng,Galaxy A32,dien-thoai-samsung-galaxy-a32-hang-chinh-hang-p88100671,5290000,4011,537.0, 5000 mAh,Li-Ion,Bluetooth v5.0,,,"Góc rộng (Wide),  Góc siêu rộng (Ultrawide),  HDR,  Lấy nét theo pha (PDAF),  Siêu cận (Macro),  Toàn cảnh (Panorama),  Xóa phông", MicroSD,,1 TB,	MediaTek Helio G80 8 nhân,2 nhân 2.0 GHz & 6 nhân 1.8 GHz,,,,128GB,,,,,1,6.4 inch,Super AMOLED,Full HD+ (1080 x 2400 Pixels),Có,"<p>Bộ sản phẩm gồm: <a class=""stdImg"">Hộp, Sách hướng dẫn, Cây lấy sim, Cáp Type C - Type A, Củ sạc nhanh rời đầu Type A</a></p>",3.5mm Stereo,2,SIM Nano (4FF),, Type-C," FullHD 1080p@120fps, FullHD 1080p@30fps",802.11 a/b/g/n/ac 2.4+5GHz,
20,147969070,111684.0,Itel,"Điện thoại thông minh itel A26  2 Sim 2 Sóng 4G LTE - Màn hình IPS 5.7"" - RAM 2GB + ROM 32 GB - Mở khoá bằng Gương Mặt -  Hàng chính hãng ",A26,dien-thoai-thong-minh-itel-a26-gia-re-2-sim-2-song-4g-lte-man-hinh-ips-5-7-hd-ram-2gb-rom-32-gb-ho-tro-the-nho-32-gb-mo-khoa-bang-guong-mat-chinh-hang-bao-hanh-12-thang-1-doi-1-trong-30-ngay-p147969070,2390000,7,284.0,2950mAh/3020mAh（min/typ）,Lithium Ion,v4.2,,,Front(2M FF))/Rear(5M AF+0.08M),Micro SD,,128GB,Spreadtrum SC9832E,Quad-core ARM CortexTM A53 1.4GHz,Single-coreARM mali820 as 3D graphics accelerator,2 GB,32 GB,2GB+32GB,<p>148*72.3*9.9mm</p>,,,,168g,5.7 inch,IPS LCD,HD+ (720 x 1520 Pixels),Có,"<p>Bộ sản phẩm gồm: Hộp, điện thoại, Thẻ bảo hành, Củ sạc, Dây sạc Tai nghe, Ốp lưng</p>",3.5mm, Dual SIM,Nano SIM,Khung và vỏ nhựa,Micro USB,Có,Có,Trung Quốc
21,88255880,25643.0,OPPO,Điện Thoại Oppo A94 (8GB/128G) - Hàng Chính Hãng,A94,dien-thoai-oppo-a94-8gb-128g-hang-chinh-hang-p88255880,7690000,4769,542.0,4310 mAh,Li-Po,"A2DP, LE, v5.1, apt-X",,,"A.I Camera, Ban đêm (Night Mode), Xóa phông, Chạm lấy nét, Toàn cảnh (Panorama), Tự động lấy nét (AF), Nhận diện khuôn mặt, HDR, Chuyên nghiệp (Pro), Làm đẹp, Góc rộng (Wide), Siêu cận (Macro), Góc siêu rộng (Ultrawide)",Micro SD,,256 GB,MediaTek Helio P95 8 nhân,2 nhân 2.2 GHz &amp; 6 nhân 2.0 GHz,	IMG PowerVR GM9446,	8 GB,	128 GB,,"<div class=div21"">",,,,,,,,,,,,,,,,,
22,2 mm</span></div>,,,,,,,,,,,,,,,,,,,,,,,,,,,,,,,,,,,,,,,,,
23,,,,,,,,,,,,,,,,,,,,,,,,,,,,,,,,,,,,,,,,,,
24,95 mm</span></div>,,,,,,,,,,,,,,,,,,,,,,,,,,,,,,,,,,,,,,,,,
25,"7 mm</span></div>""",,,,175g,6.43 inch,AMOLED,Full HD+ (1080 x 2240 pixels),,,3.5mm,2,2 Nano SIM,,Type-C,Có,"Wi-Fi hotspot, Dual-band (2.4 GHz/5 GHz), Wi-Fi 802.11 a/b/g/n/ac,",Trung Quốc,,,,,,,,,,,,,,,,,,,,,,,,
26,67910637,257333.0,Vsmart,Điện Thoại Vsmart Joy 4 - Hàng Chính Hãng,,dien-thoai-vsmart-joy-4-hang-chinh-hang-p67910637,3190000,,739.0,5000 mAh,Pin chuẩn Li-Po,V5.0,,,"Trôi nhanh thời gian (Time Lapse), A.I Camera, Xoá phông, Làm đẹp, Góc rộng (Wide), Siêu cận (Macro), Ban đêm (Night Mode), Tự động lấy nét (AF), HDR, Chuyên nghiệp (Pro)",Micro SD,,256GB,Snapdragon 665 8 nhân,4 nhân 2.0 GHz & 4 nhân 1.8 GHz,Adreno 610,4GB/3GB,64GB,Khoảng 55 GB,<p>Dài 163.65 mm - Ngang 77.65 mm - Dày 9.15 mm</p>,,,,216.4g,6.53 inch,LTPS IPS LCD,Full HD+ (1080 x 2340 Pixels),Có,"Cáp sạc, HDSD, cây lấy SIM",3.5mm,2,Nano Sim,,USB Type-C,"Quay phim FullHD 1080p@30fps, Quay phim FullHD 1080p@60fps, Quay phim FullHD 1080p@120fps, Quay phim 4K 2160p@30fps","Wi-Fi 802.11 a/b/g/n/ac, Dual-band (2.4 GHz/5 GHz)",Việt Nam
27,177141832,18802.0,Samsung,Điện Thoại Samsung Galaxy A33 5G (6GB/128GB) - Hàng Chính Hãng - Đã kích hoạt bảo hành điện tử,A33 5G,dien-thoai-samsung-galaxy-a33-5g-6gb-128gb-hang-chinh-hang-da-kich-hoat-bao-hanh-dien-tu-p177141832,8490000,28,152.0,,Li-Po,A2DP;  LE ; v5.1,,,,MicroSD,,Hỗ trợ tối đa 1 TB,Exynos 1280 8 nhân,2 nhân 2.4 GHz &amp; 6 nhân 2 GHz,,,,102 GB,<p>Dài 159.7 mm - Ngang 74 mm - Dày 8.1 mm</p>,,,,186 g,6.4 inch,Super AMOLED,Full HD+ (1080 x 2400 Pixels),,"<p>Bộ sản phẩm gồm: Hộp, Sách hướng dẫn, Cây lấy sim, Cáp Type C</p>",Type-C,2,Nano SIM,Khung &amp; Mặt lưng nhựa,Type-C,,Dual-band (2.4 GHz/5 GHz) ; Wi-Fi 802.11 a/b/g/n/ac ; Wi-Fi Direct ; Wi-Fi hotspot,
28,55518608,725567.0,DXD,Điện Thoại Smartphone DXD 20Pro Hàng Chính Hãng,,dien-thoai-smartphone-dxd-20pro-hang-chinh-hang-p55518608,990000,113,846.0,,,,,,,,,,,,,,,,,,,,,,,,,"<p>Hộp, 1 Thân Máy, 1 Pin, 1 Cáp, 1 Sạc, 1 Tai Nghe</p>",,,,,,,,Trung Quốc
29,195334253,25422.0,Xiaomi,"Điện thoại XIAOMI POCO F4 6GB+128GB /8GB+256GB | Snapdragon 870 | 6.67"" 120Hz AMOLED - Hàng chính hãng",,dien-thoai-xiaomi-poco-f4-6gb-128gb-8gb-256gb-snapdragon-870-6-67-120hz-amoled-hang-chinh-hang-p195334253,8990000,6,40.0,4500mAh,,Bluetooth 5.2,,,,,,,,"3,2 GHz",Qualcomm Adreno 650,6GB / 8GB,128GB / 256GB,256GB,"<div class=""div21"">
<div class=""div23""><span class=""xm-text split_text120"">Chiều dài: 163,2 mm</span></div>
</div>
<div class=""div24""><span class=""xm-text split_text121"">Chiều rộng: 75,95 mm</span></div>
<div class=""div25""><span class=""xm-text split_text122"">Độ dày: 7,7 mm</span></div>",,,,195G,6.67 inch,,,,"<p>Bộ sản phẩm gồm: POCO F4 / Bộ chuyển đổi 67W / Cáp USB-C / Dụng cụ tháo SIM / Hộp bảo vệ / Hướng dẫn bắt đầu nhanh / Phiếu bảo hành / Thông tin an toàn / Bộ chuyển đổi cổng Type-C sang giắc cắm tai nghe 3,5 mm</p>
<p> </p>",,,,,,,Wi-Fi 6,
30,160801751,25422.0,Xiaomi,Điện thoại Xiaomi Redmi Note 11 (4GB/128GB) - Hàng chính hãng,2201117TG (4GB/128GB),dien-thoai-xiaomi-redmi-note-11-4gb-128gb-hang-chinh-hang-p160801751,4990000,390,242.0,,Li-Po,v5.0,,,,MicroSD,,1 TB,Snapdragon 680 8 nhân,8 nhân 2.4 GHz,,,,118 GB,,,,,179 g,6.43 inch,AMOLED,Full HD+ (1080 x 2400 Pixels),,,3.5 mm,2,Nano SIM,Khung nhựa & Mặt lưng nhựa giả kính,Type-C,,"Wi-Fi 802.11 a/b/g/n/ac , Wi-Fi Direct",
31,159725951,18802.0,Samsung,Điện thoại Samsung Galaxy A03 (3GB/32GB) - Hàng chính hãng - Đã kích hoạt bảo hành điện tử,A03 32GB,dien-thoai-samsung-galaxy-a03-3gb-32gb-hang-chinh-hang-da-kich-hoat-bao-hanh-dien-tu-p159725951,3990000,19,250.0,, Li-Po, A2DP  LE  v5.0,,,,1 TB,," MicroSD, hỗ trợ tối đa 1 TB",Unisoc T606 8 nhân,8 nhân 1.6 GHz,,,,,<p>Dài 164.2 mm - Ngang 75.9 mm - Dày 9.1 mm - Nặng 196 g</p>,,,,Nặng 196 g,,PLS LCD,,,"<p>Bộ sản phẩm gồm: Hộp, Sách hướng dẫn, Cây lấy sim, Cáp Type C, Củ sạc rời đầu Type A</p>",3.5 mm,2,Nano SIM,Khung & Mặt lưng nhựa, Micro USB,, Wi-Fi 802.11 b/g/n  Wi-Fi Direct  Wi-Fi hotspot,
32,173764269,18802.0,Samsung,Điện thoại Samsung Galaxy A13 (4GB/128GB) - Hàng chính hãng - Đã kích hoạt bảo hành điện tử,Galaxy A13 ,dien-thoai-samsung-galaxy-a13-4gb-128gb-hang-chinh-hang-da-kich-hoat-bao-hanh-dien-tu-p173764269,4690000,72,175.0,, Li-Po, v5.0,,,, MicroSD,,1 TB,Exynos 850 8 nhân, 2.0 GHz,,,,105 GB,<p>Dài 165.1 mm - Ngang 76.4 mm - Dày 8.8 mm - Nặng 195 g</p>,,,,195 g,6.6 inch, PLS TFT LCD,,,"<p>Bộ sản phẩm gồm: Hộp, Sách hướng dẫn, Cây lấy sim, Cáp Type C, Củ sạc nhanh Type C</p>", 3.5 mm,2,Nano,Khung & Mặt lưng nhựa,Type-C,,Dual-band (2.4 GHz/5 GHz)  Wi-Fi 802.11 a/b/g/n/ac  Wi-Fi Direct,
33,187266104,162007.0,Tecno,Điện thoại Gaming Tecno POVA 3 (6GB)/128GB - Helio G88 | 7000 mAh | Sạc nhanh 33W - Hàng Chính Hãng,TECNO POVA 3,dien-thoai-gaming-tecno-pova-3-6-5gb-128gb-helio-g88-7000-mah-sac-nhanh-33w-hang-chinh-hang-p187266104,4990000,99,97.0,Li-Po 7000 mAh Sạc nhanh 33W,Li-Po,"5.0, A2DP, LE",,,8M/50M+2M+Q,microSDXC,,....,"MediaTek G88, Octa core",2x 2.0 GHz &amp; 6x 1.8 GHz,Mali-G52 MC2,11GB* （6GB + 5GB RAM mở rộng）,128GB,128GB,<p>173.1*78.46* 9.44mm</p>,,,,đang cập nhật ,6.9 inch,IPS LCD,,,"<p>Điện thoại, ốp trong, cáp sạc, adapter sạc, tai nghe, sách hướng dẫn sử dụng </p>",3.5 mm,2,Nano sim,đang cập nhật ,USB Type-C,,"Wi-Fi 802.11 a/b/g/n/ac, dual-band, hotspot",Trung Quốc
34,170497385,18802.0,Samsung,Điện thoại Samsung Galaxy A53 5G (8GB/128GB) - Hàng chính hãng,,dien-thoai-samsung-galaxy-a53-5g-8gb-128gb-hang-chinh-hang-p170497385,9990000,212,192.0,,,,,,,,,,,,,,,,,,,,,,,,,,,,,,,,,
35,171190775,4960305.0,Sugar,Điện thoại Smartphone Sugar A100 2GB/16GB 4G LTE - Hàng chính hãng,A100,dien-thoai-smartphone-sugar-a100-2gb-16gb-4g-lte-hang-chinh-hang-p171190775,1690000,34,189.0,,,,,,,,,,Mediatek MT6739 4 nhân 4x1.5GHz,,,,,16GB,,,,,,,,,,<p>Cáp sạc + Ốp lưng + Máy + Dây đeo</p>,,2,,,,,Có,
36,101615454,25422.0,Xiaomi,Điện Thoại Xiaomi Redmi Note 10S (8GB-128GB) - Hàng Chính Hãng,,dien-thoai-xiaomi-redmi-note-10s-8gb-128gb-hang-chinh-hang-p101615454,6490000,262,486.0,,,,,,,,,,,,,,,,,,,,,,,,,,,,,,,,,
37,129167418,111461.0,OEM,"Điện thoại itel Vision1 Pro (L6502) 3GB/32GB , 6.52"" HD+ , Camera kép - Hàng Chính Hãng",,dien-thoai-itel-vision1-pro-l6502-2gb-32gb-6-1-hd-camera-kep-hang-chinh-hang-bao-hanh-12-thang-p129167418,2300000,,350.0,4000mah,,,,,,,,,,,,3GB,32GB,,,,,,179g,6.52 inch,,,,,,,,,,,,
38,177746939,18802.0,Samsung,Điện Thoại Samsung Galaxy A73 5G (8GB/128GB) - Hàng chính hãng - ĐÃ KÍCH HOẠT BẢO HÀNH ĐIỆN TỬ,Galaxy A73 5G,dien-thoai-samsung-galaxy-a73-5g-8gb-128gb-hang-chinh-hang-da-kich-hoat-bao-hanh-dien-tu-p177746939,11000000,12,146.0,5000 mAh,Li-Po,A2DP;  LE;  v5.0,,,,MicroSD,,Hỗ trợ tối đa 1 TB,Snapdragon 778G 5G 8 nhân,4 nhân 2.4 GHz &amp; 4 nhân 1.8 GHz,,,,100GB,<p>Dài 163.7 mm - Ngang 76.1 mm - Dày 7.6 mm</p>,,,,181 g,6.7 inch,Super AMOLED Plus,Full HD+ (1080 x 2440 Pixels),,"<p>Bộ sản phẩm gồm: Hộp, Sách hướng dẫn, Cây lấy sim, Cáp Type C</p>", Type-C,2,Nano SIM (SIM 2 chung khe thẻ nhớ),Khung &amp; Mặt lưng nhựa,Type-C,,Dual-band (2.4 GHz/5 GHz);  Wi-Fi 802.11 a/b/g/n/ac/ax ; Wi-Fi Direct;  Wi-Fi hotspot,
39,175845367,18802.0,Samsung,Điện Thoại Samsung Galaxy S20 FE (8GB/256GB) - Hàng Chính Hãng - Đã kích hoạt bảo hành điện tử,,dien-thoai-samsung-galaxy-s20-fe-8gb-256gb-hang-chinh-hang-da-kich-hoat-bao-hanh-dien-tu-p175845367,13990000,69,161.0,,,,,,,,,,,,,,,,,,,,,,,,,,,,,,,,,
40,126682340,25422.0,Xiaomi,Điện thoại Xiaomi Redmi 10 (4GB/128GB) - Hàng chính hãng,Redmi 10 (4GB/128GB),dien-thoai-xiaomi-redmi-10-4gb-128gb-hang-chinh-hang-p126682340,4290000,64,361.0,,Li-Po,v5.1,,,,MicroSD,,512GB,MediaTek Helio G88 8 nhân, 2 nhân 2.0 GHz & 6 nhân 1.8 GHz,,,,100GB,,,,,181g,6.5 inch,IPS LCD,Full HD+ (1080 x 2400 Pixels),,,3.5 mm,2,Nano,Khung & Mặt lưng nhựa,Type-C,,Dual-band (2.4 GHz/5 GHz)  Wi-Fi 802.11 a/b/g/n/ac  Wi-Fi Direct  Wi-Fi hotspot,
41,169547788,25422.0,Xiaomi,Điện Thoại Xiaomi Redmi Note 11 Pro 8GB/128GB - Hàng Chính Hãng,Note 11 Pro 8GB/128GB,dien-thoai-xiaomi-redmi-note-11-pro-8gb-128gb-hang-chinh-hang-p169547788,7490000,17,194.0,,Li-Po,A2DP  LE  v5.1,,,,MicroSD,,Tối đa 256 GB,MediaTek Helio G96 8 nhân, 2 nhân 2.05 GHz & 6 nhân 2.0 GHz,,8GB,128GB,,<p>Dài 164.19 mm - Ngang 76.1 mm - Dày 8.12 mm - Nặng 202 g</p>,,,,202 g,6.67 inch,AMOLED,,,"<p>Bộ sản phẩm bao gồm: Bộ sạc, cáp USB Type-C, dụng cụ tháo sim, ốp bảo vệ, hướng dẫn sử dụng.</p>", 3.5 mm,2,Nano SIM (SIM 2 chung khe thẻ nhớ),Khung nhựa & Mặt lưng kính, 3.5 mm,,Dual-band (2.4 GHz/5 GHz)  Wi-Fi 802.11 a/b/g/n/ac  Wi-Fi Direct  Wi-Fi hotspot,
42,135322157,19673.0,Nokia,Điện Thoại Nokia C20 2GB/32GB - Hàng Chính Hãng,C20 2GB/32GB,dien-thoai-nokia-c20-2gb-32gb-hang-chinh-hang-p135322157,2490000,34,333.0,,," A2DP, v4.2",,,,Tối đa 256 GB,,"MicroSD, hỗ trợ tối đa 256 GB", Spreadtrum SC9863A 8 nhân, 4 nhân 1.6 GHz & 4 nhân 1.2 GHz,,,,,"<div class=""ctLeft"">
<p>Kích thước, khối lượng:</p>
</div>
<div class=""ctRight""><span class="""">Dài 169.9 mm - Ngang 77.9 mm - Dày 8.8 mm - Nặng 191 g</span></div>",,,,191g,6.5 inch, IPS LCD,HD+ (720 x 1600 pixels),,"<p>Điện Thoại Nokia C20 2GB/32GB - Hàng Chính Hãng</p>
<p>Bộ sản phẩm bao gồm: Thân máy, cáp micro USB, sạc, tai nghe, ốp silicon, sách hướng dẫn sử dụng.</p>",3.5 mm,2,Li-Ion,Khung & Mặt lưng nhựa Polycarbonate, Micro USB,,"Wi-Fi hotspot, Wi-Fi 802.11 a/b/g/n",
43,184696247,247549.0,Realme,Điện thoại Realme C35 4GB/64GB - Hàng chính hãng,,dien-thoai-realme-c35-4gb-64gb-hang-chinh-hang-p184696247,4290000,7,108.0,,, v5.0,,,,,,, Unisoc T616 8 nhân,,,,,64GB,,,,,,6.6 inch, IPS LCD,,,,,,,,Type C,,Dual-band (2.4 GHz/5 GHz),
44,155339564,111461.0,OEM,Điện thoại Itel A26 (2GB/32GB) - Bảo hành 12 tháng - Hàng chính hãng ,,dien-thoai-itel-a26-2gb-32gb-bao-hanh-12-thang-hang-chinh-hang-p155339564,1990000,28,265.0,,,,,,,,,,,,,,,,,,,,,,,,,,,,,,,,,
45,160801738,25422.0,Xiaomi,Điện thoại Xiaomi Redmi Note 11 (4GB/64GB) - Hàng chính hãng,2201117TG (4GB/64GB),dien-thoai-xiaomi-redmi-note-11-4gb-64gb-hang-chinh-hang-p160801738,4690000,,241.0,,Li-Po,v5.0,,,,MicroSD,,1 TB,Snapdragon 680 8 nhân,8 nhân 2.4 GHz,,,,54 GB,,,,,179 g,6.43 inch,AMOLED,Full HD+ (1080 x 2400 Pixels),,,3.5 mm,2,Nano SIM,Khung nhựa & Mặt lưng nhựa giả kính,Type-C,,"Wi-Fi 802.11 a/b/g/n/ac , Wi-Fi Direct",
46,121744434,25422.0,Xiaomi,Điện Thoại Xiaomi Redmi 10 4GB/128GB - Hàng Chính Hãng,Điện Thoại Xiaomi Redmi 10 4GB/128GB,dien-thoai-xiaomi-redmi-10-4gb-128gb-hang-chinh-hang-p121744434,4290000,83,383.0,5000 mAh, Li-Po, v5.1,,,, MicroSD,,Tối đa 512 GB,MediaTek Helio G88 8 nhân, 2 nhân 2.0 GHz & 6 nhân 1.8 GHz,Mali-G52 MC2, 4 GB,128GB,,<p>Dài 161 mm - Ngang 75.53 mm - Dày 8.92 mm - Nặng 181g</p>,,,,181g,6.5 inch,,Full HD+ (1080 x 2400 Pixels),,"<p>Bộ sản phẩm bao gồm: Pin, sạc, cáp USB kiểu C, ốp lưng, hướng dẫn, cây tháo sim.</p>", 3.5 mm,2,Nano SIM, Khung & Mặt lưng nhựa,,,Dual-band (2.4 GHz/5 GHz)  Wi-Fi 802.11 a/b/g/n/ac  Wi-Fi Direct  Wi-Fi hotspot,
47,181503298,25422.0,Xiaomi,Điện thoại Xiaomi Redmi Note 11 [4GB/128GB] [6GB/128GB] |Dimensity 810| Full Ngôn Ngữ - BH 12 tháng,Redmi Note 11,dien-thoai-xiaomi-redmi-note-11-4gb-128gb-6gb-128gb-dimensity-810-full-ngon-ngu-bh-12-thang-p181503298,5690000,29,129.0,5000 mAh,"5.000 mAh, hỗ trợ sạc nhanh 18 W",v5.0,,, AI Camera  Ban đêm (Night Mode)  Bộ lọc màu  Chuyên nghiệp (Pro)  Google Lens  Góc rộng (Wide)  HDR  Làm đẹp  Quay chậm (Slow Motion)  Siêu cận (Macro)  Toàn cảnh (Panorama)  Trôi nhanh thời gian (Time Lapse)  Xóa phông,"MicroSD, hỗ trợ tối đa 1 TB",,1 TB,MediaTek Helio G80, 2.4 GHz,Adreno 610,4GB/6GB,128GB,118 GB,"<p>Kích thước, khối lượng: Dài 159.8 mm - Ngang 73.87 mm - Dày 8.09 mm - Nặng 179 g</p>",,,,Nặng 179 g,6.43 inch, AMOLED,Full HD+ (1080 x 2400 Pixels),CÓ,"<p>Bộ sản phẩm bao gồm: điện thoại, cáp sạc pin, sách hướng dẫn</p>",3.5mm,2 Nano SIM,Nano,Khung nhựa &amp; Mặt lưng nhựa giả kính,Type C,,Wi-Fi 802.11 a/b/g/n/acWi-Fi Direct,Trung Quốc
